{
  "name": "javaspider-starter-job",
  "runtime": "browser",
  "target": {
    "url": "https://example.com"
  },
  "extract": [
    {
      "field": "title",
      "type": "css",
      "expr": "title"
    }
  ],
  "output": {
    "format": "json",
    "path": "artifacts/exports/job-output.json"
  },
  "metadata": {
    "mock_extract": {
      "title": "JavaSpider Starter Demo"
    }
  }
}
